{
  "mapId": "novice_plain",
  "mapName": "曙光平原（原创占位图）",
  "width": 64,
  "height": 64,
  "aoiCellSize": 8,
  "aoiRadiusCells": 1,
  "spawnX": 10,
  "spawnY": 10,
  "blockedCells": [
    {
      "x": 15,
      "y": 15
    },
    {
      "x": 15,
      "y": 16
    },
    {
      "x": 16,
      "y": 15
    }
  ],
  "safeZones": [
    {
      "name": "spawn_safe",
      "x1": 7,
      "y1": 7,
      "x2": 15,
      "y2": 15
    }
  ],
  "portals": []
}
