{
  "mapId": "novice_plain",
  "mapName": "曙光镇外（原创，对照新手主城）",
  "width": 64,
  "height": 64,
  "aoiCellSize": 8,
  "aoiRadiusCells": 1,
  "spawnX": 10,
  "spawnY": 10,
  "blockedCells": [
    {
      "x": 15,
      "y": 15
    },
    {
      "x": 15,
      "y": 16
    },
    {
      "x": 16,
      "y": 15
    },
    {
      "x": 20,
      "y": 20
    },
    {
      "x": 20,
      "y": 21
    },
    {
      "x": 21,
      "y": 20
    }
  ],
  "safeZones": [
    {
      "name": "新手村",
      "x1": 5,
      "y1": 5,
      "x2": 18,
      "y2": 18
    }
  ],
  "portals": [
    {
      "portalId": "to_forest",
      "x": 30,
      "y": 10,
      "targetMapId": "dark_forest",
      "targetX": 5,
      "targetY": 5
    },
    {
      "portalId": "to_sabuk_palace",
      "x": 10,
      "y": 8,
      "targetMapId": "dark_forest",
      "targetX": 20,
      "targetY": 20
    },
    {
      "portalId": "to_marsh",
      "x": 40,
      "y": 18,
      "targetMapId": "marsh_den",
      "targetX": 4,
      "targetY": 4
    },
    {
      "portalId": "to_oath",
      "x": 18,
      "y": 30,
      "targetMapId": "oath_city",
      "targetX": 8,
      "targetY": 8
    }
  ]
}
